{
  "$schema": "https://json-schema.org/draft/2020-12/schema",
  "title": "ArchManifest",
  "type": "object",
  "properties": {
    "capabilities": {
      "type": "array",
      "items": {
        "$ref": "#/$defs/Capability"
      },
      "uniqueItems": true
    },
    "clearance": {
      "$ref": "#/$defs/Clearance"
    },
    "context_ceiling": {
      "type": "integer",
      "format": "uint32",
      "minimum": 0
    },
    "cost_per_1k_tokens_eur": {
      "description": "What a thousand prompt tokens cost on this arch, in euros — or `None`\nwhen this node has no price list for it.\n\n`None` is not zero and must never be rendered as one (SP1b Task 2b fix\nround 1, Ruling 30). `Some(0.0)` is a claim: nothing is billed, which\nis true of a local model and of a subscription. `None` is the absence\nof a claim — the Bedrock arch, whose prices are AWS's and which this\nnode has not read — and an operator shown `0` there would believe the\ncalls were free. `vk top` prints `?`.",
      "type": [
        "number",
        "null"
      ],
      "format": "double"
    },
    "determinism": {
      "$ref": "#/$defs/Determinism"
    },
    "governed": {
      "description": "True only if the kernel launched and contains the inference process (spec §3.3).",
      "type": "boolean"
    },
    "identity": {
      "$ref": "#/$defs/ArchIdentity"
    },
    "jurisdiction": {
      "description": "ISO 3166 country code, or \"EU\".",
      "type": "string"
    },
    "latency_ms_p50": {
      "type": "integer",
      "format": "uint32",
      "minimum": 0
    },
    "locality": {
      "$ref": "#/$defs/Locality"
    },
    "name": {
      "type": "string"
    },
    "quota": {
      "description": "What the provider's plan lets this arch be asked for, when the\nmanifest makes a claim about it (founder decision 2026-10-15).\n\nA **claim**, like `retention_days` and `cost_per_1k_tokens_eur`: what\nthe plan says, not what this node has measured and not something the\nkernel enforces. What the kernel *observes* — a 429, a spent balance,\na model the provider has withdrawn — is the arch's health, which the\nkernel holds beside the manifest and never writes into it.\n\nPart of the arch id when present (see [`ArchManifest::arch_id`]): a\nplan change is a new arch. Absent, it is not serialised at all, so a\nmanifest written before this field existed keeps both its arch id and\nits canonical hash — which is what the `arches` table holds and what\nthe boot path compares against.",
      "anyOf": [
        {
          "$ref": "#/$defs/QuotaProfile"
        },
        {
          "type": "null"
        }
      ]
    },
    "retention_days": {
      "type": [
        "integer",
        "null"
      ],
      "format": "uint32",
      "minimum": 0
    }
  },
  "required": [
    "name",
    "capabilities",
    "locality",
    "jurisdiction",
    "latency_ms_p50",
    "context_ceiling",
    "determinism",
    "identity",
    "clearance",
    "governed"
  ],
  "$defs": {
    "ArchIdentity": {
      "description": "Everything that changes model behaviour. Any change = a new arch id.",
      "type": "object",
      "properties": {
        "backend": {
          "type": "string"
        },
        "batch": {
          "type": "integer",
          "format": "uint32",
          "minimum": 0
        },
        "engine": {
          "type": "string"
        },
        "engine_version": {
          "type": "string"
        },
        "kv_cache": {
          "type": "string"
        },
        "quant": {
          "type": "string"
        },
        "sampling": {
          "type": "object",
          "additionalProperties": {
            "type": "string"
          }
        },
        "seed": {
          "type": [
            "integer",
            "null"
          ],
          "format": "uint64",
          "minimum": 0
        },
        "threads": {
          "type": "integer",
          "format": "uint32",
          "minimum": 0
        },
        "weights_sha256": {
          "type": "string"
        }
      },
      "required": [
        "weights_sha256",
        "engine",
        "engine_version",
        "backend",
        "quant",
        "kv_cache",
        "threads",
        "batch",
        "sampling"
      ]
    },
    "Capability": {
      "type": "string",
      "enum": [
        "generate",
        "embed",
        "predict",
        "perceive",
        "plan",
        "judge"
      ]
    },
    "Clearance": {
      "type": "object",
      "properties": {
        "max_scope": {
          "$ref": "#/$defs/Scope"
        },
        "third_party_allowed": {
          "type": "boolean"
        }
      },
      "required": [
        "max_scope",
        "third_party_allowed"
      ]
    },
    "Determinism": {
      "type": "string",
      "enum": [
        "seeded_deterministic",
        "non_deterministic"
      ]
    },
    "Locality": {
      "type": "string",
      "enum": [
        "local",
        "on_prem",
        "peer",
        "cloud"
      ]
    },
    "QuotaProfile": {
      "description": "The provider plan an arch is used under, and the limits that plan states.\n\nEvery limit is optional, because a plan does not always publish one — a\nsubscription states a usage window rather than a token rate — and a limit\nthis node does not know is left out rather than guessed. A limit of zero\nis refused (schema and [`ArchManifest::validate`] alike): absent already\nsays \"no figure\", and a plan that allows nothing is not a plan the arch is\nused under but a spent one, which is health the kernel observes\n(`exhausted`), not a claim a manifest makes.\n\nUnknown fields are refused: `tokens_per_min` mistyped for\n`tokens_per_minute` would otherwise read back as \"no limit stated\", the\none silent misreading a quota can have. Absent limits are not serialised,\nso the arch id of a quota stays the same if a later limit is added to this\ntype and left unset.",
      "type": "object",
      "properties": {
        "plan": {
          "description": "A free label for the plan: `subscription`, `pay-as-you-go`,\n`free-tier`, a provider's tier name. Printed by `vk arch show`, so at\nmost 64 characters and never blank.",
          "type": "string",
          "maxLength": 64,
          "minLength": 1
        },
        "requests_per_minute": {
          "type": [
            "integer",
            "null"
          ],
          "format": "uint32",
          "minimum": 1
        },
        "tokens_per_day": {
          "type": [
            "integer",
            "null"
          ],
          "format": "uint64",
          "minimum": 1
        },
        "tokens_per_minute": {
          "type": [
            "integer",
            "null"
          ],
          "format": "uint32",
          "minimum": 1
        }
      },
      "additionalProperties": false,
      "required": [
        "plan"
      ]
    },
    "Scope": {
      "description": "Ordered low → high. `Holdout` is the top: readable only by the rehearsal verifier role.",
      "type": "string",
      "enum": [
        "public",
        "vertical",
        "business",
        "personal",
        "holdout"
      ]
    }
  }
}
