{ "name": "anthropic/claude-opus-5", "capabilities": ["generate", "plan", "judge"], "locality": "cloud", "jurisdiction": "US", "retention_days": 30,
  "cost_per_1k_tokens_eur": 0.0046, "latency_ms_p50": 9000, "context_ceiling": 200000, "determinism": "non_deterministic",
  "identity": { "weights_sha256": "model:claude-opus-5", "engine": "anthropic-api", "engine_version": "2023-06-01", "backend": "anthropic-first-party", "quant": "-",
                "kv_cache": "-", "threads": 0, "batch": 0, "sampling": {}, "seed": null },
  "clearance": { "max_scope": "business", "third_party_allowed": false }, "governed": false,
  "quota": { "plan": "pay-as-you-go", "requests_per_minute": 50, "tokens_per_minute": 30000 } }
